<?xml version="1.0" encoding="UTF-8"?>
<!ELEMENT projectRecord ( title, data, team, abstract, deliverables) >
<!ELEMENT title (#PCDATA) >

<!ELEMENT data (title, subtitle*, beginDate, endDate, supervisor) >
<!ELEMENT subtitle (#PCDATA) >
<!ELEMENT beginDate (#PCDATA) >
<!ELEMENT endDate (#PCDATA) >
<!ELEMENT supervisor (#PCDATA) >
<!ATTLIST supervisor
            href CDATA #REQUIRED>

<!ELEMENT team (element+) >
<!ELEMENT element (name, number, email) >
<!ELEMENT name (#PCDATA) >
<!ELEMENT number (#PCDATA) >
<!ELEMENT email (#PCDATA) >

<!ELEMENT abstract (paragraph+) >

<!ELEMENT paragraph (line+) >
<!ELEMENT line (#PCDATA|i|b|u|ref)* >
<!ELEMENT i (#PCDATA|b|u|ref)* >
<!ELEMENT b (#PCDATA|i|u|ref)* >
<!ELEMENT u (#PCDATA|i|b|ref)* >

<!ELEMENT deliverables (ref+) >
<!ELEMENT ref (#PCDATA) >
<!ATTLIST ref
            url CDATA #REQUIRED >